{
  "company": "AsterNova Technologies Ltd.",
  "base_fiscal_year": "FY2026",
  "currency": "INR",
  "scale": "MILLIONS",
  "quarterly_projections": [
    {
      "period": "FY2026-Q1",
      "quarter": 1,
      "revenue": 350.8,
      "cogs": 158.35,
      "opex": 127.93,
      "operating_income": 64.52,
      "capex": 17.54
    },
    {
      "period": "FY2026-Q2",
      "quarter": 2,
      "revenue": 364.42,
      "cogs": 164.5,
      "opex": 129.75,
      "operating_income": 70.17,
      "capex": 18.22
    },
    {
      "period": "FY2026-Q3",
      "quarter": 3,
      "revenue": 370.98,
      "cogs": 167.46,
      "opex": 131.56,
      "operating_income": 71.96,
      "capex": 18.55
    },
    {
      "period": "FY2026-Q4",
      "quarter": 4,
      "revenue": 385.22,
      "cogs": 173.89,
      "opex": 133.38,
      "operating_income": 77.95,
      "capex": 19.26
    }
  ]
}